ID,URL,Title,Benefits,Challenges
SBOM1,https://info.aquasec.com/gartner-sboms?keyword=sbom%20software&campaignID=16876372065&matchtype=b&adgroupID=144056923908&utm_source=adwords&utm_campaign=SBOM+-+United+States+-+2022&utm_medium=ppc&utm_term=sbom%20software&hsa_acc=4069508776&hsa_src=g&hsa_ad=592695723831&hsa_kw=sbom%20software&hsa_ver=3&hsa_mt=b&hsa_grp=144056923908&hsa_net=adwords&hsa_cam=16876372065&hsa_tgt=kwd-1089210418727&gclid=Cj0KCQjwkt6aBhDKARIsAAyeLJ2YATzQNkIMhp1MWnHCmGqpLdg0e2OMkPb7PyCyFwp3WS3R9EEts38aAoyeEALw_wcB,Innovation Insight for SBOMs Report,YES,YES
SBOM2,https://www.techtarget.com/searchsecurity/post/The-benefits-and-challenges-of-SBOMs,The benefits and challenges of SBOMs,YES,YES
SBOM3,https://www.helpnetsecurity.com/2022/02/09/sbom-readiness-adoption/,78% of organizations expect to produce or consume SBOMs in 2022,YES,YES
SBOM4,https://welpmagazine.com/sbom-generation-and-adoption-challenges-solutions/,SBOM Generation And Adoption: Challenges & Solutions,YES,YES
SBOM5,https://blog.reversinglabs.com/blog/the-sbom-is-evolving-4-key-trends-boost-software-supply-chain-security,The SBOM is evolving: 4 key trends boosting software supply chain security,,YES
SBOM7,https://www.ntia.gov/files/ntia/publications/ntia_sbom_software_identity-2021mar30.pdf,Software Identification Challenges and Guidance,,YES
SBOM8,https://www.linuxfoundation.org/research/the-state-of-software-bill-of-materials-sbom-and-cybersecurity-readiness,The State of Software Bill of Materials (SBOM) and Cybersecurity Readiness,YES,YES
SBOM10,https://www.boozallen.com/insights/cyber/tech/reducing-software-supply-chain-risks-with-sboms.html,REDUCING SOFTWARE SUPPLY CHAIN RISKS WITH SBOMS,YES,
SBOM11,https://www.mend.io/resources/blog/white-house-issues-new-guidelines-on-software-supply-chain-security-what-are-the-challenges-and-possible-outcomes/,White House Issues New Guidelines on Software Supply Chain Security – What Are the Challenges and Possible Outcomes?,YES,YES
SBOM12,https://slsa.dev/blog/2022/05/slsa-sbom,SBOM + SLSA: Accelerating SBOM success with the help of SLSA,YES,YES
SBOM16,https://www.mckinsey.com/capabilities/risk-and-resilience/our-insights/cybersecurity/software-bill-of-materials-managing-software-cybersecurity-risks,Software bill of materials: Managing software cybersecurity risks,YES,
SBOM18,https://www.endorlabs.com/blog/sbom-is-just-a-means-to-an-end,SBOMs are just a means to an end,YES,YES
SBOM19,https://finitestate.io/blog/the-sbom-is-coming-with-allan-friedman,"The SBOM Is Coming, with Allan Friedman",,YES
SBOM20,https://blog.tidelift.com/sboms-are-important-but-they-wont-work-if-we-dont-pay-the-maintainers,Software bills of materials are important—but they won't work at scale if we don't pay the maintainers,YES,YES
SBOM21,https://anchore.com/sbom/key-things-to-know-about-sboms-and-sbom-standards/,Key Things to Know about SBOMs and SBOM Standards,YES,
SBOM23,https://www.forbes.com/sites/forbestechcouncil/2021/12/03/its-time-for-businesses-to-demand-that-software-vendors-provide-an-sbom/?sh=2bfc5a67aa2c,It's Time For Businesses To Demand That Software Vendors Provide An SBoM,YES,
SBOM24,https://www.reseller.co.nz/article/698906/software-supply-chain-security-fixes-gain-prominence-rsa-2022/,Software supply chain security fixes gain prominence at RSA 2022,,YES
SBOM26,https://www.devprojournal.com/software-development-trends/sbom/5-sbom-resources-every-software-developer-should-bookmark/,5 SBOM Resources Every Software Developer Should Bookmark,YES,
SBOM27,https://www.nature.com/articles/s41746-021-00403-w,Building resilient medical technology supply chains with a software bill of materials,YES,
SBOM28,atlanticcouncil.org/content-series/buying-down-risk/software-prov-and-comp/,Buying down risk: Software provenance and composition,YES,YES
SBOM29,https://www.mend.io/resources/blog/reporting-vs-remediation-sbom/,The Benefits and Challenges of Reporting vs. Remediation with SBOMs,YES,YES
SBOM30,https://www.infoworld.com/article/3645452/why-sbom-management-is-no-longer-optional.html,Why SBOM management is no longer optional,,YES
SBOM31,https://securityboulevard.com/2022/10/a-software-bill-of-materials-sbom-what-it-is-and-why-it-matters-for-software-supply-chain-security/,A software bill of materials (SBOM): What it is — and why it matters for software supply chain security,,YES
SBOM32,https://scribesecurity.com/sbom/,What is a Software Bill of Materials (SBOM)? A Deep Dive,YES,YES
SBOM33,https://www.activestate.com/blog/why-the-us-government-is-mandating-software-bill-of-materials-sbom/,Why The US Government Is Mandating Software Bill Of Materials (SBOM),YES,
SBOM38,https://thenewstack.io/sboms-are-great-for-supply-chain-security-but-buyers-beware/,SBOMs Are Great for Supply Chain Security but Buyers Beware,YES,YES
SBOM39,https://www.guardrails.io/blog/what-is-a-software-bill-of-materials-and-why-is-it-important-for-security/,"What is a software bill of materials, and why is it important for security?",YES,YES
SBOM40,https://accelerationeconomy.com/cybersecurity/understanding-the-sbom-market-collision/,Understanding the SBOM Market Collision,,YES
SBOM41,https://industrialcyber.co/threats-attacks/prepping-up-for-2022-as-ot-industry-focuses-on-federal-government-regulations-sboms/,"Prepping up for 2022, as OT industry focuses on federal government regulations, SBOMs",YES,YES
SBOM42,https://dbom-project.readthedocs.io/en/latest/use-cases.html,Software Bill of Materials,,YES
SBOM43,https://www.spiceworks.com/it-security/vulnerability-management/articles/sbom-critical-mitigate-software-supply-chain-risks/,Why Software Bill of Materials (SBOM) Is Critical To Mitigating Software Supply Chain Risks,YES,YES
SBOM44,https://www.helpnetsecurity.com/2022/09/06/government-guide-supply-chain-security/,"Government guide for supply chain security: The good, the bad and the ugly",,YES
SBOM45,https://www.revenera.com/blog/software-composition-analysis/whats-trending-with-sboms-developers-and-code-scanning/,"What’s Trending with SBOMs, Developers, and Code Scanning",,YES
SBOM46,https://www.devprojournal.com/software-development-trends/software-bill-of-materials-sboms-good-for-security-tough-to-maintain/,"Software Bill of Materials (SBOMs): Good for Security, Tough to Maintain",YES,YES
SBOM47,https://fossa.com/blog/software-bill-of-materials-formats-use-cases-tools/,"Software Bill Of Materials: Formats, Use Cases, and Tools",YES,
SBOM48,https://www.esecurityplanet.com/compliance/sbom/,SBOMs: Securing the Software Supply Chain,YES,YES
SBOM49,https://www.novaleah.com/sbom-the-security-benefits-of-a-software-bill-of-materials/,SBOM – The Security Benefits of a Software Bill of Materials,YES,
SBOM51,https://cloudsmith.com/blog/understanding-and-implementing-a-software-bill-of-materials/,Understanding and Implementing a Software Bill of Materials,YES,
SBOM52,https://www.scmagazine.com/perspective/policy/three-ways-to-ensure-a-successful-transition-to-sbom%EF%BF%BC,Three ways to ensure a successful transition to SBOM,,YES
SBOM53,https://www.sdxcentral.com/articles/news/cisa-executive-impels-sbom-adoption-following-white-house-memo/2022/09/,CISA Executive Impels SBOM Adoption Following White House Memo,,YES
SBOM55,https://www.cybeats.com/news/relay-provides-state-of-cybersecurity-webinar-highlights-about-sbom-recording-posted-on-youtube,Scryb Provides State of Cybersecurity Webinar Highlights About SBoM,YES,YES
SBOM57,https://www.rezilion.com/blog/3-ways-a-dynamic-sbom-enhances-security/,3 Ways a Dynamic SBOM Enhances Security,YES,
SBOM58,https://www.deepfactor.io/sbom-plus-appsec-observability-can-defend-against-software-supply-chain-attacks/,SBOM: the 1st Step Towards Defending Against SW Supply Chain Attacks,YES,YES
SBOM59,https://thehill.com/opinion/cybersecurity/564787-software-bill-of-materials-not-just-good-for-security-good-for-business/,"Software Bill of Materials’ — Not just good for security, good for business",YES,
SBOM60,https://venturebeat.com/security/sboms-what-they-are-and-why-organizations-need-them/,SBOMs: What they are and why organizations need them,YES,YES
SBOM61,https://securityboulevard.com/2022/09/research-shows-extent-of-organizational-sbom-readiness-techstrong-tv/,Research Shows Extent of Organizational SBOM Readiness – Techstrong TV,YES,
SBOM62,https://blog.packagecloud.io/are-you-using-the-best-tools-for-sboms-to-improve-security/,Are You Using the Best Tools for SBOMS to Improve Security?,YES,
SBOM63,https://licens.io/2022/03/30/sboms-the-premise-the-promise-the-peril/,"SBOMS: THE PREMISE, THE PROMISE, THE PERIL",YES,YES
SBOM64,https://www.cpomagazine.com/cyber-security/taking-down-popular-sbom-myths/,Taking Down Popular SBOM Myths,YES,
SBOM65,https://www.protocol.com/enterprise/biden-sbom-open-source-software,The White House wants new transparency into software components. The security benefits won't arrive quickly.,YES,YES
SBOM66,https://devops.com/why-we-need-a-software-bill-of-materials-industry-standard/,Why We Need a Software Bill of Materials Industry Standard,YES,
SBOM67,https://www.lmgsecurity.com/sbom-now-a-priority-according-to-new-report-on-open-source-code-risks/,SBOMs Now a Priority According to New Report on Open-Source Code Risks,YES,
SBOM68,https://visualmodo.com/leveraging-the-sbom-for-continuous-cybersecurity/,Leveraging the SBOM for Continuous Cybersecurity,YES,
SBOM69,https://www.globenewswire.com/news-release/2021/09/21/2300215/0/en/Relay-Provides-State-of-Cybersecurity-Webinar-Highlights-About-SBoM-Recording-Posted-on-YouTube.html,Relay Provides State of Cybersecurity Webinar Highlights About SBoM; Recording Posted on YouTube,YES,
SBOM70,https://www.paloaltonetworks.com/blog/prisma-cloud/full-stack-visibility-with-software-bill-of-materials-generation/,Full-Stack Code Visibility With Prisma Cloud Software Bill of Materials (SBOM) Generation,YES,YES
SBOM71,https://tcblog.protiviti.com/2022/01/26/looking-forward-sbom-to-improve-responsiveness-for-the-next-log4shell/,Looking Forward: SBOM to Improve Responsiveness For the Next Log4Shell,YES,
SBOM72,https://network-king.net/sbom-and-its-role-in-cybersecurity/,SBOM and its role in cybersecurity,YES,YES
SBOM73,https://devblogs.microsoft.com/engineering-at-microsoft/generating-software-bills-of-materials-sboms-with-spdx-at-microsoft/,Generating Software Bills of Materials (SBOMs) with SPDX at Microsoft,YES,
SBOM74,https://www.cidersecurity.io/blog/research/why-generating-sbom-based-on-your-code-is-far-from-enough/,Why generating SBOM based on your code is far from enough,YES,YES
SBOM75,https://www.deployhub.com/understanding-software-bill-of-materials-sboms/#challenges,What are Software Bill of Materials (SBOMs)?,YES,YES
SBOM76,https://securityboulevard.com/2021/08/the-future-of-the-sbom/,The Future of SBOM,YES,YES
SBOM77,https://www.enterprisenetworkingplanet.com/security/software-bill-of-materials-sbom-pros-cons/,Software Bill of Materials (SBOM) Pros & Cons,YES,YES
,,,50,41